{
  "schema_version": "knowledge_layer/v1",
  "artifact_id": "knowledge_layer",
  "producer": "knowledge-layer-core",
  "producer_version": "0.29.1",
  "deterministic": true,
  "llm_generated": false,
  "scope_id": "static-data-model-7f62d9df01e0d487a7bdbc9b",
  "scope_type": "workspace",
  "repository_count": 2,
  "repository_ids": [
    "ucp_api",
    "ucp_tsa_v4"
  ],
  "modes": [
    "data-model"
  ],
  "build_id": "build_87f0d36195c2798ee932",
  "build_status": "complete",
  "database_path": "knowledge-layer.duckdb",
  "manifest_path": "knowledge-layer-manifest.json",
  "counts": {
    "workspace_repository": 2,
    "source_record": 22017,
    "data_model_domain": 0,
    "data_model_cluster": 0,
    "data_model_entity": 0,
    "data_model_attribute": 0,
    "data_model_association": 0,
    "java_type_declaration": 1326,
    "code_field_observation": 2252,
    "java_inheritance_observation": 984,
    "effective_entity_field": 4666,
    "effective_entity_association": 0,
    "data_model_generalization": 0,
    "physical_asset": 0,
    "physical_asset_fact": 0,
    "physical_column": 0,
    "physical_constraint": 0,
    "entity_physical_mapping": 0,
    "declared_value_set": 0,
    "data_dictionary_entry": 416,
    "persistent_structure": 0,
    "persistent_structure_attribute": 0,
    "db_schema_table": 0,
    "db_schema_column": 0,
    "db_schema_key": 0,
    "db_schema_relationship": 0,
    "db_schema_constraint": 0,
    "db_schema_index": 0,
    "db_schema_partitioning": 0,
    "db_schema_sequence": 0,
    "db_schema_trigger": 0,
    "table_relationship_observation": 0,
    "table_relationship_column_pair": 0,
    "table_key_observation": 0,
    "table_key_observation_column": 0,
    "data_model_local_correspondence_observation": 0,
    "workspace_missing_fact": 14033,
    "source_inspection_request": 4,
    "evidence_ref": 209486,
    "data_model_correspondence_observation": 0,
    "source_observation": 170810,
    "type_reference_resolution_candidate": 862,
    "configuration_type_correspondence_observation": 326,
    "model_object_key_observation": 312,
    "model_object_key_member": 514,
    "model_relationship_observation": 504,
    "model_relationship_key_expression": 888,
    "model_relationship_storage_key_derivation": 202,
    "model_relationship_reference_value_key_correspondence": 241,
    "model_relationship_storage_reference": 224,
    "model_relationship_polymorphic_target": 19,
    "model_embedded_field_observation": 0,
    "model_relationship_candidate": 19,
    "artifact_dependency_correspondence_observation": 161
  },
  "materialized_marts": [
    "common-data-model-inventory",
    "physical-and-persistence-model",
    "database-schema-model",
    "table-key-and-relationship-observations",
    "source-observation-index",
    "effective-field-model",
    "configuration-type-correspondence",
    "workspace-correspondence-observations",
    "workspace-type-reference-resolution",
    "framework-tsa-model-object-keys",
    "framework-tsa-model-relationships",
    "artifact-dependency-correspondence"
  ],
  "capabilities": [
    "common.data-model",
    "common.effective-model",
    "common.physical-model",
    "common.source-observations",
    "common.path-queries",
    "common.field-flow-queries",
    "common.keys",
    "common.relationships",
    "workspace.cross-repository",
    "framework.tsa"
  ],
  "artifacts": {
    "database": "knowledge-layer.duckdb",
    "manifest": "knowledge-layer-manifest.json",
    "summary": "workspace_data_model_summary.json",
    "exports": "exports"
  },
  "source_evidence": [
    {
      "repo_id": "ucp_api",
      "repository_analysis_manifest": "/mnt/data/iteration28_work/ucp_static_data_model_run_0_40_7/repository-analysis/ucp_api/repository-analysis-manifest.json",
      "static_analysis_output": "/mnt/data/iteration28_work/ucp_static_data_model_run_0_40_7/repository-analysis/ucp_api/static-analysis-output",
      "analysis_fingerprint": "6b75e2cb5c11a2ffcc1793c9ce53a4e565e4d85b26dbcd7181db10afd4494e67",
      "imported_counts": {
        "data_model_domain": 0,
        "data_model_cluster": 0,
        "physical_asset": 0,
        "physical_asset_fact": 0,
        "physical_column": 0,
        "physical_constraint": 0,
        "data_model_entity": 0,
        "data_model_attribute": 0,
        "data_model_association": 0,
        "java_type_declaration": 828,
        "code_field_observation": 1873,
        "java_inheritance_observation": 604,
        "effective_entity_field": 0,
        "effective_entity_association": 0,
        "entity_physical_mapping": 0,
        "declared_value_set": 0,
        "data_dictionary_entry": 416,
        "workspace_missing_fact": 316,
        "source_inspection_request": 0,
        "persistent_structure": 0,
        "persistent_structure_attribute": 0,
        "db_schema_table": 0,
        "db_schema_column": 0,
        "db_schema_key": 0,
        "db_schema_relationship": 0,
        "db_schema_constraint": 0,
        "db_schema_index": 0,
        "db_schema_partitioning": 0,
        "db_schema_sequence": 0,
        "db_schema_trigger": 0,
        "table_relationship_observation": 0,
        "table_relationship_column_pair": 0,
        "table_key_observation": 0,
        "table_key_observation_column": 0,
        "source_observation_call_argument_flow_observation": 3612,
        "source_observation_code_annotation": 3169,
        "source_observation_collection_mutation_observation": 33,
        "source_observation_configuration_comment_observation": 0,
        "source_observation_configuration_entry": 43,
        "source_observation_configuration_object_observation": 9,
        "source_observation_configuration_reference_observation": 3,
        "source_observation_configuration_reference_resolution_observation": 3,
        "source_observation_constructed_value_observation": 10768,
        "source_observation_cross_module_call_resolution_observation": 0,
        "source_observation_cross_module_type_resolution_observation": 0,
        "source_observation_module_boundary_interaction_observation": 0,
        "source_observation_unresolved_module_reference_observation": 2824,
        "source_observation_external_dependency": 157,
        "source_observation_build_dependency_observation": 0,
        "source_observation_module_dependency_observation": 0,
        "source_observation_gradle_project_observation": 1,
        "source_observation_gradle_module_observation": 1,
        "source_observation_gradle_external_dependency_observation": 0,
        "source_observation_gradle_plugin_observation": 0,
        "source_observation_gradle_version_catalog_observation": 0,
        "source_observation_gradle_included_build_observation": 0,
        "source_observation_gradle_source_set_observation": 0,
        "source_observation_gradle_repository_observation": 0,
        "source_observation_gradle_applied_script_observation": 0,
        "source_observation_gradle_unresolved_dependency_observation": 0,
        "source_observation_java_method_call_observation": 5272,
        "source_observation_java_call_parameter_binding_observation": 1481,
        "source_observation_java_call_result_binding_observation": 1655,
        "source_observation_java_method_parameter_observation": 4440,
        "source_observation_java_method_implementation_observation": 226,
        "source_observation_java_method_parameter_correspondence_observation": 3,
        "source_observation_java_method_reference_observation": 13,
        "source_observation_tsa_annotation_observation": 426,
        "source_observation_tsa_converter_configuration_observation": 0,
        "source_observation_tsa_configuration_directive_observation": 0,
        "source_observation_tsa_reference_operation_observation": 0,
        "source_observation_tsa_key_expression_observation": 40,
        "source_observation_tsa_storage_key_lineage_observation": 0,
        "source_observation_tsa_reference_value_derivation_observation": 0,
        "source_observation_storage_alias_assignment_observation": 0,
        "source_observation_storage_record_observation": 0,
        "source_observation_storage_reference_observation": 0,
        "source_observation_type_reference_observation": 9181,
        "source_observation": 43360,
        "data_model_generalization": 0,
        "source_record": 4084
      }
    },
    {
      "repo_id": "ucp_tsa_v4",
      "repository_analysis_manifest": "/mnt/data/iteration28_work/ucp_static_data_model_run_0_40_7/repository-analysis/ucp_tsa_v4/repository-analysis-manifest.json",
      "static_analysis_output": "/mnt/data/iteration28_work/ucp_static_data_model_run_0_40_7/repository-analysis/ucp_tsa_v4/static-analysis-output",
      "analysis_fingerprint": "7bd06c03de5516947d3d1da0d37d3078486fedc9f8f1d371a78e589e53889855",
      "imported_counts": {
        "data_model_domain": 0,
        "data_model_cluster": 0,
        "physical_asset": 0,
        "physical_asset_fact": 0,
        "physical_column": 0,
        "physical_constraint": 0,
        "data_model_entity": 0,
        "data_model_attribute": 0,
        "data_model_association": 0,
        "java_type_declaration": 498,
        "code_field_observation": 379,
        "java_inheritance_observation": 380,
        "effective_entity_field": 0,
        "effective_entity_association": 0,
        "entity_physical_mapping": 0,
        "declared_value_set": 0,
        "data_dictionary_entry": 0,
        "workspace_missing_fact": 13717,
        "source_inspection_request": 4,
        "persistent_structure": 0,
        "persistent_structure_attribute": 0,
        "db_schema_table": 0,
        "db_schema_column": 0,
        "db_schema_key": 0,
        "db_schema_relationship": 0,
        "db_schema_constraint": 0,
        "db_schema_index": 0,
        "db_schema_partitioning": 0,
        "db_schema_sequence": 0,
        "db_schema_trigger": 0,
        "table_relationship_observation": 0,